{
  "id": "vrm-local-1",
  "status": "succeeded",
  "avatarConfig": {
    "avatarId": "demo-avatar"
  },
  "vrm": {
    "meta": {
      "name": "demo-avatar",
      "version": "0.1.0",
      "author": "oneme",
      "contactInformation": "https://github.com/piacerex/oneme",
      "licenseName": "repository",
      "commercialUsage": "allowed"
    },
    "humanoid": {
      "hips": "hips",
      "spine": "spine",
      "chest": "chest",
      "neck": "neck",
      "head": "head",
      "leftUpperArm": "leftUpperArm",
      "leftLowerArm": "leftLowerArm",
      "leftHand": "leftHand",
      "rightUpperArm": "rightUpperArm",
      "rightLowerArm": "rightLowerArm",
      "rightHand": "rightHand",
      "leftUpperLeg": "leftUpperLeg",
      "leftLowerLeg": "leftLowerLeg",
      "leftFoot": "leftFoot",
      "rightUpperLeg": "rightUpperLeg",
      "rightLowerLeg": "rightLowerLeg",
      "rightFoot": "rightFoot"
    },
    "expressions": ["neutral", "happy", "blink", "surprised"],
    "springBones": ["hair", "accessory"]
  },
  "modelUrl": "blob:oneme-vrm-demo",
  "createdAt": "2026-07-09T00:00:00.000Z",
  "finishedAt": "2026-07-09T00:00:01.000Z"
}
